{
  "$schema": "./hosted-ci-window.schema.json",
  "schemaVersion": 1,
  "startsAfter": "2026-08-21T23:40:00Z",
  "requiredApplicableRuns": 20,
  "assessments": [
    {
      "runId": "32539965981",
      "workflow": "design-accessibility-traceability",
      "createdAt": "2026-08-22T00:19:39Z",
      "classification": "applicable-clean",
      "reason": "Required pull-request check completed successfully for candidate commit 8f06772f8819b15b3a625d856b984508fc9cec38."
    },
    {
      "runId": "32539965982",
      "workflow": "security-rights-privacy",
      "createdAt": "2026-08-22T00:19:39Z",
      "classification": "applicable-clean",
      "reason": "Required pull-request check completed successfully for candidate commit 8f06772f8819b15b3a625d856b984508fc9cec38."
    },
    {
      "runId": "32539965984",
      "workflow": "windows-quality",
      "createdAt": "2026-08-22T00:19:39Z",
      "classification": "applicable-clean",
      "reason": "Required pull-request check completed successfully for candidate commit 8f06772f8819b15b3a625d856b984508fc9cec38."
    },
    {
      "runId": "32539965986",
      "workflow": "documentation-integrity",
      "createdAt": "2026-08-22T00:19:39Z",
      "classification": "applicable-clean",
      "reason": "Required pull-request check completed successfully for candidate commit 8f06772f8819b15b3a625d856b984508fc9cec38."
    },
    {
      "runId": "32539980988",
      "workflow": "macos-ios-build",
      "createdAt": "2026-08-22T00:19:57Z",
      "classification": "applicable-clean",
      "reason": "Candidate-gated native build completed successfully for the WP-007/WP-008 recovery implementation."
    },
    {
      "runId": "32540313485",
      "workflow": "design-accessibility-traceability",
      "createdAt": "2026-08-22T00:25:46Z",
      "classification": "applicable-clean",
      "reason": "Required pull-request check completed successfully for candidate commit ea8301bbdefed80dc5242af37d15ff62c0bb1507."
    },
    {
      "runId": "32540313518",
      "workflow": "documentation-integrity",
      "createdAt": "2026-08-22T00:25:46Z",
      "classification": "applicable-clean",
      "reason": "Required pull-request check completed successfully for candidate commit ea8301bbdefed80dc5242af37d15ff62c0bb1507."
    },
    {
      "runId": "32540313522",
      "workflow": "windows-quality",
      "createdAt": "2026-08-22T00:25:46Z",
      "classification": "applicable-clean",
      "reason": "Required pull-request check completed successfully for candidate commit ea8301bbdefed80dc5242af37d15ff62c0bb1507."
    },
    {
      "runId": "32540313555",
      "workflow": "security-rights-privacy",
      "createdAt": "2026-08-22T00:25:46Z",
      "classification": "applicable-clean",
      "reason": "Required pull-request check completed successfully for candidate commit ea8301bbdefed80dc5242af37d15ff62c0bb1507."
    },
    {
      "runId": "32649889734",
      "workflow": "security-rights-privacy",
      "createdAt": "2026-08-23T15:52:05Z",
      "classification": "applicable-clean",
      "reason": "Required pull-request check completed successfully for candidate commit 8f46b4f6397cc547eae9f4c45dc48deb57ad5a38."
    },
    {
      "runId": "32649889740",
      "workflow": "design-accessibility-traceability",
      "createdAt": "2026-08-23T15:52:05Z",
      "classification": "applicable-clean",
      "reason": "Required pull-request check completed successfully for candidate commit 8f46b4f6397cc547eae9f4c45dc48deb57ad5a38."
    },
    {
      "runId": "32649889742",
      "workflow": "documentation-integrity",
      "createdAt": "2026-08-23T15:52:05Z",
      "classification": "applicable-clean",
      "reason": "Required pull-request check completed successfully for candidate commit 8f46b4f6397cc547eae9f4c45dc48deb57ad5a38."
    },
    {
      "runId": "32649889743",
      "workflow": "windows-quality",
      "createdAt": "2026-08-23T15:52:05Z",
      "classification": "applicable-clean",
      "reason": "Required pull-request check completed successfully for candidate commit 8f46b4f6397cc547eae9f4c45dc48deb57ad5a38."
    },
    {
      "runId": "32650388170",
      "workflow": "macos-ios-build",
      "createdAt": "2026-08-23T16:01:40Z",
      "classification": "applicable-clean",
      "reason": "Candidate-gated Xcode 26.4.1 native build completed successfully for exact commit 8f46b4f6397cc547eae9f4c45dc48deb57ad5a38."
    }
  ]
}
